{
  "$schema": "https://json-schema.org/draft/2020-12/schema",
  "$id": "atlas://schemas/atlas.plan.v1.json",
  "title": "ATLAS plan v1",
  "type": "object",
  "additionalProperties": false,
  "required": [
    "contract_version",
    "id",
    "title",
    "summary",
    "status",
    "owner",
    "created_at",
    "updated_at",
    "related_session_refs",
    "related_artifact_refs",
    "evidence_refs",
    "supersedes",
    "superseded_by"
  ],
  "properties": {
    "contract_version": {
      "type": "string",
      "const": "atlas.plan.v1"
    },
    "id": {
      "type": "string",
      "minLength": 1
    },
    "title": {
      "type": "string",
      "minLength": 1
    },
    "summary": {
      "type": "string",
      "minLength": 1
    },
    "status": {
      "type": "string",
      "minLength": 1
    },
    "owner": {
      "type": "string",
      "minLength": 1
    },
    "created_at": {
      "type": "string",
      "format": "date-time"
    },
    "updated_at": {
      "type": "string",
      "format": "date-time"
    },
    "related_session_refs": {
      "type": "array",
      "items": { "type": "string", "minLength": 1 }
    },
    "related_artifact_refs": {
      "type": "array",
      "items": { "type": "string", "minLength": 1 }
    },
    "evidence_refs": {
      "type": "array",
      "items": { "type": "string", "minLength": 1 }
    },
    "supersedes": {
      "type": "array",
      "items": { "type": "string", "minLength": 1 }
    },
    "superseded_by": {
      "type": "array",
      "items": { "type": "string", "minLength": 1 }
    },
    "metadata": {
      "type": "object"
    }
  }
}
