{
  "contract_version": "atlas.plan.v1",
  "id": "wave-8b-awareness-closure",
  "title": "Wave 8B Awareness Closure",
  "summary": "Sequence lock determinism, observation closure, working memory indexing, and Playbook no-dark-state enforcement into one governed rollout.",
  "status": "active",
  "owner": "stack-root",
  "created_at": "2026-04-14T12:15:00Z",
  "updated_at": "2026-04-14T12:15:00Z",
  "related_session_refs": [
    "runtime/atlas/sessions/session-atlas-session-readonly-20260414T080843Z/session.manifest.json"
  ],
  "related_artifact_refs": [
    "runtime/atlas/sessions/session-atlas-session-readonly-20260414T080843Z/artifacts/worker.assignment.json",
    "runtime/atlas/sessions/session-atlas-session-readonly-20260414T080843Z/artifacts/worker.context.json",
    "runtime/lifeline/worker-execution/session-atlas-session-readonly-20260414T080843Z-assignment/receipt-session-atlas-session-readonly-20260414T080843Z-request-1776154124391.json"
  ],
  "evidence_refs": [
    "docs/architecture/AWARENESS-FIRST-WORLD-MODEL.md",
    "docs/ops/STACK-LOCKFILE.md",
    "runtime/atlas/sessions/session-atlas-session-readonly-20260414T080843Z/session.manifest.json"
  ],
  "supersedes": [],
  "superseded_by": [],
  "metadata": {
    "milestone": "wave-8b",
    "focus_areas": [
      "lockfile",
      "observations",
      "working-memory",
      "playbook"
    ]
  }
}
